INSTALL EXTENSION vsql_vector;
call mtr.add_suppression("VillageSQL.*Invalid value in column.*SVECTOR.*failed to decode value");
# Create table with two SVECTOR columns
CREATE TABLE vector_rollback_test (
id INT PRIMARY KEY,
name VARCHAR(50),
vec1 SVECTOR(6) NOT NULL,
vec2 SVECTOR(6) NOT NULL,
value INT
) ENGINE=InnoDB;
#
# Test 1: Rollback INSERT operations
#
START TRANSACTION;
INSERT INTO vector_rollback_test VALUES (1, 'row1', '[1.0, 2.0, 3.0, 4.0, 5.0, 6.0]', '[0.1, 0.2, 0.3, 0.4, 0.5, 0.6]', 100);
INSERT INTO vector_rollback_test VALUES (2, 'row2', '[2.0, 3.0, 4.0, 5.0, 6.0, 7.0]', '[0.2, 0.3, 0.4, 0.5, 0.6, 0.7]', 200);
INSERT INTO vector_rollback_test VALUES (3, 'row3', '[3.0, 4.0, 5.0, 6.0, 7.0, 8.0]', '[0.3, 0.4, 0.5, 0.6, 0.7, 0.8]', 300);
SELECT id, name, SVECTOR::TO_STRING(vec1) AS vec1_str, SVECTOR::TO_STRING(vec2) AS vec2_str, value FROM vector_rollback_test ORDER BY id;
id	name	vec1_str	vec2_str	value
1	row1	[1,2,3,4,5,6]	[0.100000001,0.200000003,0.300000012,0.400000006,0.5,0.600000024]	100
2	row2	[2,3,4,5,6,7]	[0.200000003,0.300000012,0.400000006,0.5,0.600000024,0.699999988]	200
3	row3	[3,4,5,6,7,8]	[0.300000012,0.400000006,0.5,0.600000024,0.699999988,0.800000012]	300
ROLLBACK;
# Verify table is empty after rollback
SELECT id, name, SVECTOR::TO_STRING(vec1) AS vec1_str, SVECTOR::TO_STRING(vec2) AS vec2_str, value FROM vector_rollback_test ORDER BY id;
id	name	vec1_str	vec2_str	value
#
# Test 2: Rollback DELETE operations
#
# Insert data first
INSERT INTO vector_rollback_test VALUES (1, 'row1', '[1.0, 2.0, 3.0, 4.0, 5.0, 6.0]', '[0.1, 0.2, 0.3, 0.4, 0.5, 0.6]', 100);
INSERT INTO vector_rollback_test VALUES (2, 'row2', '[2.0, 3.0, 4.0, 5.0, 6.0, 7.0]', '[0.2, 0.3, 0.4, 0.5, 0.6, 0.7]', 200);
INSERT INTO vector_rollback_test VALUES (3, 'row3', '[3.0, 4.0, 5.0, 6.0, 7.0, 8.0]', '[0.3, 0.4, 0.5, 0.6, 0.7, 0.8]', 300);
START TRANSACTION;
DELETE FROM vector_rollback_test WHERE id = 2;
SELECT id, name, SVECTOR::TO_STRING(vec1) AS vec1_str, SVECTOR::TO_STRING(vec2) AS vec2_str, value FROM vector_rollback_test ORDER BY id;
id	name	vec1_str	vec2_str	value
1	row1	[1,2,3,4,5,6]	[0.100000001,0.200000003,0.300000012,0.400000006,0.5,0.600000024]	100
3	row3	[3,4,5,6,7,8]	[0.300000012,0.400000006,0.5,0.600000024,0.699999988,0.800000012]	300
ROLLBACK;
# Verify all rows are restored after rollback
SELECT id, name, SVECTOR::TO_STRING(vec1) AS vec1_str, SVECTOR::TO_STRING(vec2) AS vec2_str, value FROM vector_rollback_test ORDER BY id;
id	name	vec1_str	vec2_str	value
1	row1	[1,2,3,4,5,6]	[0.100000001,0.200000003,0.300000012,0.400000006,0.5,0.600000024]	100
2	row2	[2,3,4,5,6,7]	[0.200000003,0.300000012,0.400000006,0.5,0.600000024,0.699999988]	200
3	row3	[3,4,5,6,7,8]	[0.300000012,0.400000006,0.5,0.600000024,0.699999988,0.800000012]	300
#
# Test 3: Rollback UPDATE - only SVECTOR columns
#
START TRANSACTION;
UPDATE vector_rollback_test SET vec1 = '[10.0, 20.0, 30.0, 40.0, 50.0, 60.0]', vec2 = '[1.0, 2.0, 3.0, 4.0, 5.0, 6.0]' WHERE id = 1;
SELECT id, name, SVECTOR::TO_STRING(vec1) AS vec1_str, SVECTOR::TO_STRING(vec2) AS vec2_str, value FROM vector_rollback_test WHERE id = 1;
id	name	vec1_str	vec2_str	value
1	row1	[10,20,30,40,50,60]	[1,2,3,4,5,6]	100
ROLLBACK;
# Verify SVECTOR columns are restored after rollback
SELECT id, name, SVECTOR::TO_STRING(vec1) AS vec1_str, SVECTOR::TO_STRING(vec2) AS vec2_str, value FROM vector_rollback_test WHERE id = 1;
id	name	vec1_str	vec2_str	value
1	row1	[1,2,3,4,5,6]	[0.100000001,0.200000003,0.300000012,0.400000006,0.5,0.600000024]	100
#
# Test 4: Rollback UPDATE - only Primary Key column
#
START TRANSACTION;
UPDATE vector_rollback_test SET id = 10 WHERE id = 1;
SELECT id, name, SVECTOR::TO_STRING(vec1) AS vec1_str, SVECTOR::TO_STRING(vec2) AS vec2_str, value FROM vector_rollback_test ORDER BY id;
id	name	vec1_str	vec2_str	value
2	row2	[2,3,4,5,6,7]	[0.200000003,0.300000012,0.400000006,0.5,0.600000024,0.699999988]	200
3	row3	[3,4,5,6,7,8]	[0.300000012,0.400000006,0.5,0.600000024,0.699999988,0.800000012]	300
10	row1	[1,2,3,4,5,6]	[0.100000001,0.200000003,0.300000012,0.400000006,0.5,0.600000024]	100
ROLLBACK;
# Verify PK is restored after rollback
SELECT id, name, SVECTOR::TO_STRING(vec1) AS vec1_str, SVECTOR::TO_STRING(vec2) AS vec2_str, value FROM vector_rollback_test ORDER BY id;
id	name	vec1_str	vec2_str	value
1	row1	[1,2,3,4,5,6]	[0.100000001,0.200000003,0.300000012,0.400000006,0.5,0.600000024]	100
2	row2	[2,3,4,5,6,7]	[0.200000003,0.300000012,0.400000006,0.5,0.600000024,0.699999988]	200
3	row3	[3,4,5,6,7,8]	[0.300000012,0.400000006,0.5,0.600000024,0.699999988,0.800000012]	300
#
# Test 5: Rollback UPDATE - only non-PK and non-SVECTOR columns
#
START TRANSACTION;
UPDATE vector_rollback_test SET name = 'updated_row1', value = 999 WHERE id = 1;
SELECT id, name, SVECTOR::TO_STRING(vec1) AS vec1_str, SVECTOR::TO_STRING(vec2) AS vec2_str, value FROM vector_rollback_test WHERE id = 1;
id	name	vec1_str	vec2_str	value
1	updated_row1	[1,2,3,4,5,6]	[0.100000001,0.200000003,0.300000012,0.400000006,0.5,0.600000024]	999
ROLLBACK;
# Verify non-SVECTOR columns are restored after rollback
SELECT id, name, SVECTOR::TO_STRING(vec1) AS vec1_str, SVECTOR::TO_STRING(vec2) AS vec2_str, value FROM vector_rollback_test WHERE id = 1;
id	name	vec1_str	vec2_str	value
1	row1	[1,2,3,4,5,6]	[0.100000001,0.200000003,0.300000012,0.400000006,0.5,0.600000024]	100
#
# Test 6: Rollback UPDATE - PK, SVECTOR, and other columns
#
START TRANSACTION;
UPDATE vector_rollback_test SET id = 20, name = 'updated_row2', vec1 = '[20.0, 30.0, 40.0, 50.0, 60.0, 70.0]', vec2 = '[2.0, 3.0, 4.0, 5.0, 6.0, 7.0]', value = 2000 WHERE id = 2;
SELECT id, name, SVECTOR::TO_STRING(vec1) AS vec1_str, SVECTOR::TO_STRING(vec2) AS vec2_str, value FROM vector_rollback_test ORDER BY id;
id	name	vec1_str	vec2_str	value
1	row1	[1,2,3,4,5,6]	[0.100000001,0.200000003,0.300000012,0.400000006,0.5,0.600000024]	100
3	row3	[3,4,5,6,7,8]	[0.300000012,0.400000006,0.5,0.600000024,0.699999988,0.800000012]	300
20	updated_row2	[20,30,40,50,60,70]	[2,3,4,5,6,7]	2000
ROLLBACK;
# Verify all columns are restored after rollback
SELECT id, name, SVECTOR::TO_STRING(vec1) AS vec1_str, SVECTOR::TO_STRING(vec2) AS vec2_str, value FROM vector_rollback_test ORDER BY id;
id	name	vec1_str	vec2_str	value
1	row1	[1,2,3,4,5,6]	[0.100000001,0.200000003,0.300000012,0.400000006,0.5,0.600000024]	100
2	row2	[2,3,4,5,6,7]	[0.200000003,0.300000012,0.400000006,0.5,0.600000024,0.699999988]	200
3	row3	[3,4,5,6,7,8]	[0.300000012,0.400000006,0.5,0.600000024,0.699999988,0.800000012]	300
#
# Test 7: Rollback mixed operations (INSERT, UPDATE, DELETE)
#
START TRANSACTION;
# Insert new row
INSERT INTO vector_rollback_test VALUES (4, 'row4', '[7.0, 8.0, 9.0, 10.0, 11.0, 12.0]', '[0.7, 0.8, 0.9, 1.0, 1.1, 1.2]', 400);
# Update existing row
UPDATE vector_rollback_test SET vec1 = '[100.0, 200.0, 300.0, 400.0, 500.0, 600.0]', value = 9999 WHERE id = 3;
# Delete existing row
DELETE FROM vector_rollback_test WHERE id = 1;
SELECT id, name, SVECTOR::TO_STRING(vec1) AS vec1_str, SVECTOR::TO_STRING(vec2) AS vec2_str, value FROM vector_rollback_test ORDER BY id;
id	name	vec1_str	vec2_str	value
2	row2	[2,3,4,5,6,7]	[0.200000003,0.300000012,0.400000006,0.5,0.600000024,0.699999988]	200
3	row3	[100,200,300,400,500,600]	[0.300000012,0.400000006,0.5,0.600000024,0.699999988,0.800000012]	9999
4	row4	[7,8,9,10,11,12]	[0.699999988,0.800000012,0.899999976,1,1.10000002,1.20000005]	400
ROLLBACK;
# Verify all operations are rolled back
SELECT id, name, SVECTOR::TO_STRING(vec1) AS vec1_str, SVECTOR::TO_STRING(vec2) AS vec2_str, value FROM vector_rollback_test ORDER BY id;
id	name	vec1_str	vec2_str	value
1	row1	[1,2,3,4,5,6]	[0.100000001,0.200000003,0.300000012,0.400000006,0.5,0.600000024]	100
2	row2	[2,3,4,5,6,7]	[0.200000003,0.300000012,0.400000006,0.5,0.600000024,0.699999988]	200
3	row3	[3,4,5,6,7,8]	[0.300000012,0.400000006,0.5,0.600000024,0.699999988,0.800000012]	300
#
# Test 8: Rollback UPDATE with SVECTOR::FROM_STRING UDF
#
START TRANSACTION;
# TODO: Enable after decode works with constants for parameterized types
UPDATE vector_rollback_test SET vec1 = SVECTOR::FROM_STRING('[11.0, 12.0, 13.0, 14.0, 15.0, 16.0]') WHERE id = 2;
ERROR HY000: Invalid value in column '???' of type 'vsql_vector.SVECTOR' at row 1: check server log for details
UPDATE vector_rollback_test SET vec1 = '[11.0, 12.0, 13.0, 14.0, 15.0, 16.0]' WHERE id = 2;
SELECT id, name, SVECTOR::TO_STRING(vec1) AS vec1_str, SVECTOR::TO_STRING(vec2) AS vec2_str, value FROM vector_rollback_test WHERE id = 2;
id	name	vec1_str	vec2_str	value
2	row2	[11,12,13,14,15,16]	[0.200000003,0.300000012,0.400000006,0.5,0.600000024,0.699999988]	200
ROLLBACK;
# Verify SVECTOR column is restored after rollback
SELECT id, name, SVECTOR::TO_STRING(vec1) AS vec1_str, SVECTOR::TO_STRING(vec2) AS vec2_str, value FROM vector_rollback_test WHERE id = 2;
id	name	vec1_str	vec2_str	value
2	row2	[2,3,4,5,6,7]	[0.200000003,0.300000012,0.400000006,0.5,0.600000024,0.699999988]	200
#
# Test 9: Rollback multiple UPDATEs on same row
#
START TRANSACTION;
UPDATE vector_rollback_test SET vec1 = '[11.0, 12.0, 13.0, 14.0, 15.0, 16.0]' WHERE id = 1;
UPDATE vector_rollback_test SET vec2 = '[1.1, 1.2, 1.3, 1.4, 1.5, 1.6]' WHERE id = 1;
UPDATE vector_rollback_test SET value = 1111 WHERE id = 1;
SELECT id, name, SVECTOR::TO_STRING(vec1) AS vec1_str, SVECTOR::TO_STRING(vec2) AS vec2_str, value FROM vector_rollback_test WHERE id = 1;
id	name	vec1_str	vec2_str	value
1	row1	[11,12,13,14,15,16]	[1.10000002,1.20000005,1.29999995,1.39999998,1.5,1.60000002]	1111
ROLLBACK;
# Verify all updates are rolled back
SELECT id, name, SVECTOR::TO_STRING(vec1) AS vec1_str, SVECTOR::TO_STRING(vec2) AS vec2_str, value FROM vector_rollback_test WHERE id = 1;
id	name	vec1_str	vec2_str	value
1	row1	[1,2,3,4,5,6]	[0.100000001,0.200000003,0.300000012,0.400000006,0.5,0.600000024]	100
#
# Test 10: Rollback with both SVECTOR columns updated separately
#
START TRANSACTION;
UPDATE vector_rollback_test SET vec1 = '[50.0, 60.0, 70.0, 80.0, 90.0, 100.0]' WHERE id = 3;
UPDATE vector_rollback_test SET vec2 = '[5.0, 6.0, 7.0, 8.0, 9.0, 10.0]' WHERE id = 3;
SELECT id, name, SVECTOR::TO_STRING(vec1) AS vec1_str, SVECTOR::TO_STRING(vec2) AS vec2_str, value FROM vector_rollback_test WHERE id = 3;
id	name	vec1_str	vec2_str	value
3	row3	[50,60,70,80,90,100]	[5,6,7,8,9,10]	300
ROLLBACK;
# Verify both SVECTOR columns are restored
SELECT id, name, SVECTOR::TO_STRING(vec1) AS vec1_str, SVECTOR::TO_STRING(vec2) AS vec2_str, value FROM vector_rollback_test WHERE id = 3;
id	name	vec1_str	vec2_str	value
3	row3	[3,4,5,6,7,8]	[0.300000012,0.400000006,0.5,0.600000024,0.699999988,0.800000012]	300
#
# Test 11: Rollback DELETE all rows
#
START TRANSACTION;
DELETE FROM vector_rollback_test;
SELECT COUNT(*) AS record_count FROM vector_rollback_test;
record_count
0
ROLLBACK;
# Verify all rows are restored after rollback
SELECT id, name, SVECTOR::TO_STRING(vec1) AS vec1_str, SVECTOR::TO_STRING(vec2) AS vec2_str, value FROM vector_rollback_test ORDER BY id;
id	name	vec1_str	vec2_str	value
1	row1	[1,2,3,4,5,6]	[0.100000001,0.200000003,0.300000012,0.400000006,0.5,0.600000024]	100
2	row2	[2,3,4,5,6,7]	[0.200000003,0.300000012,0.400000006,0.5,0.600000024,0.699999988]	200
3	row3	[3,4,5,6,7,8]	[0.300000012,0.400000006,0.5,0.600000024,0.699999988,0.800000012]	300
# Cleanup
DROP TABLE vector_rollback_test;
# SVECTOR rollback test completed
UNINSTALL EXTENSION vsql_vector;
